{
  "schema_version": "tools-manual-qa/1.0.0",
  "manual_id": "tools",
  "release_status": "unapproved-qa-verified",
  "owner_subepic": 4725,
  "inspection_mode": "complete-zero-sampling",
  "sampling_rate": 1.0,
  "artifacts_manifest_sha256_lf": "4b8dfd92c851fbe18a5f527179a87a37dd22251b4cb24e69309ebfe7ea030a99",
  "inspections": {
    "pdf": {
      "path": "manuals/tools/dist/tools-engineering-design-manual.pdf",
      "sha256": "5ad05de7dd340873eb8f39c4ec3be22cee5ba1de7da13816fe55a8ad7b1e9779",
      "bytes": 286808,
      "page_count": 12,
      "uninspected_pages": 0,
      "fonts": [
        "/DSTOOL+LMMathItalic10-Bold",
        "/DSTOOL+LMMathItalic10-Regular",
        "/DSTOOL+LMMathItalic7-Regular",
        "/DSTOOL+LMMathSymbols10-Regular",
        "/DSTOOL+LMMathSymbols7-Regular",
        "/DSTOOL+LMMono10-Regular",
        "/DSTOOL+LMRoman10-Bold",
        "/DSTOOL+LMRoman10-Regular",
        "/DSTOOL+LMRoman7-Regular",
        "/DSTOOL+NimbusSanL-Bold",
        "/DSTOOL+NimbusSanL-Regu",
        "/DSTOOL+NimbusSanL-ReguItal"
      ],
      "outline_item_count": 76,
      "total_images": 1,
      "total_annotations": 4,
      "pages": [
        {
          "page_number": 1,
          "character_count": 2299,
          "line_count": 33,
          "image_count": 0,
          "annotation_count": 0,
          "first_line_prefix": "Tools Engineering Design Manual"
        },
        {
          "page_number": 2,
          "character_count": 3201,
          "line_count": 44,
          "image_count": 0,
          "annotation_count": 0,
          "first_line_prefix": "Tools Engineering Design Manual Generated - Unapproved"
        },
        {
          "page_number": 3,
          "character_count": 3345,
          "line_count": 44,
          "image_count": 0,
          "annotation_count": 0,
          "first_line_prefix": "Tools Engineering Design Manual Generated - Unapproved"
        },
        {
          "page_number": 4,
          "character_count": 1738,
          "line_count": 29,
          "image_count": 1,
          "annotation_count": 0,
          "first_line_prefix": "Tools Engineering Design Manual Generated - Unapproved"
        },
        {
          "page_number": 5,
          "character_count": 2917,
          "line_count": 41,
          "image_count": 0,
          "annotation_count": 0,
          "first_line_prefix": "Tools Engineering Design Manual Generated - Unapproved"
        },
        {
          "page_number": 6,
          "character_count": 2234,
          "line_count": 40,
          "image_count": 0,
          "annotation_count": 0,
          "first_line_prefix": "Tools Engineering Design Manual Generated - Unapproved"
        },
        {
          "page_number": 7,
          "character_count": 1803,
          "line_count": 41,
          "image_count": 0,
          "annotation_count": 0,
          "first_line_prefix": "Tools Engineering Design Manual Generated - Unapproved"
        },
        {
          "page_number": 8,
          "character_count": 2384,
          "line_count": 41,
          "image_count": 0,
          "annotation_count": 0,
          "first_line_prefix": "Tools Engineering Design Manual Generated - Unapproved"
        },
        {
          "page_number": 9,
          "character_count": 2666,
          "line_count": 41,
          "image_count": 0,
          "annotation_count": 0,
          "first_line_prefix": "Tools Engineering Design Manual Generated - Unapproved"
        },
        {
          "page_number": 10,
          "character_count": 2417,
          "line_count": 39,
          "image_count": 0,
          "annotation_count": 0,
          "first_line_prefix": "Tools Engineering Design Manual Generated - Unapproved"
        },
        {
          "page_number": 11,
          "character_count": 3355,
          "line_count": 42,
          "image_count": 0,
          "annotation_count": 0,
          "first_line_prefix": "Tools Engineering Design Manual Generated - Unapproved"
        },
        {
          "page_number": 12,
          "character_count": 545,
          "line_count": 9,
          "image_count": 0,
          "annotation_count": 4,
          "first_line_prefix": "Tools Engineering Design Manual Generated - Unapproved"
        }
      ]
    },
    "docx": {
      "path": "manuals/tools/dist/tools-engineering-design-manual.docx",
      "sha256": "4089d9766ee595ace553f01bb6644e81ee54130df27fab1994878c4193027464",
      "bytes": 73789,
      "paragraph_count": 205,
      "heading_count": 77,
      "math_element_count": 52,
      "table_count": 1,
      "drawing_count": 1,
      "bookmark_count": 82,
      "unresolved_reference_count": 0
    },
    "html": {
      "path": "manuals/tools/dist/tools-engineering-design-manual.html",
      "sha256": "5760e567ea28508f07cd025e95fb6d9e1f36b9f99b52daa3379b79b059152df4",
      "bytes": 106378,
      "has_lang": true,
      "has_viewport": true,
      "mathml_block_count": 52,
      "table_count": 1,
      "image_count": 1,
      "images_with_valid_alt": 1,
      "images_missing_alt": 0,
      "unresolved_reference_count": 0
    },
    "tex": {
      "path": "manuals/tools/dist/tools-engineering-design-manual.tex",
      "sha256": "36eac866e332adcd7692b772beb449badb55f55b3483d399fc3eef2547f4c264",
      "bytes": 44879,
      "has_geometry": true,
      "has_microtype": true,
      "figure_count": 2,
      "csl_reference_block_present": true,
      "unresolved_reference_count": 0
    }
  },
  "cross_format_integrity": {
    "semantic_phrases_verified": 10,
    "figure_presence_verified": true,
    "table_presence_verified": true,
    "math_representation_verified": true,
    "status": "verified-semantic-parity"
  },
  "blockers": [
    {
      "id": "TOOLS-D8-PUBLICATION-PENDING",
      "owner": "TOOLS-D8 subepic #4728",
      "resolution": "Establish immutable public publication projection under TOOLS-D8 before releasing artifacts."
    },
    {
      "id": "TOOLS-HUMAN-APPROVAL-PENDING",
      "owner": "Lead systems maintainers",
      "resolution": "Recorded page and accessibility review requires explicit maintainer sign-off prior to publication."
    }
  ]
}
